{
  "schema": "runx.doctor.v1",
  "status": "failure",
  "summary": {
    "errors": 1,
    "warnings": 0,
    "infos": 0
  },
  "diagnostics": [
    {
      "id": "runx.structure.cross_package_reach_in",
      "severity": "error",
      "title": "Cross-package src reach-in is forbidden",
      "message": "packages/cli/src/index.ts imports ../../core/src/index.js, reaching into packages/core/src directly.",
      "target": {
        "kind": "workspace",
        "ref": "packages/cli/src/index.ts"
      },
      "location": {
        "path": "packages/cli/src/index.ts"
      },
      "evidence": {
        "specifier": "../../core/src/index.js",
        "source_package": "cli",
        "target_package": "core",
        "resolved_path": "packages/core/src/index.js"
      },
      "repairs": [
        {
          "id": "replace_with_package_boundary_import",
          "kind": "manual",
          "confidence": "high",
          "risk": "low",
          "requires_human_review": false
        }
      ],
      "instance_id": "sha256:75b598877662b0da272fa62557e56d1346d5c93a9a17c3e72cec49a2856f64e6"
    }
  ]
}
